title,date,time,speakers,description,status,registerLink,recordingLink
AI in Business: The 2026 Landscape,2026-02-28,2:00 PM GMT,"Jayson Smith (AI Strategy Consultant), Sarah Lee (Data Scientist)","Join us for an in-depth exploration of how artificial intelligence is reshaping business strategy, operations, and decision-making in 2026. Learn practical applications and implementation strategies.",upcoming,https://forms.google.com/,
Data Strategy for Insurance,2026-03-15,3:00 PM GMT,"Mohammad Irfan (Data Scientist & Actuary)","Master your organization's data strategy with practical frameworks and real-world case studies from the insurance industry.",upcoming,https://forms.google.com/,
IFRS 17 Implementation Best Practices,2026-04-10,2:00 PM GMT,"Piyush Goel (Actuarial Director), Kate Bleakley (Actuary)","Deep dive into IFRS 17 implementation challenges and solutions. Covers measurement models, transition approaches, and reporting requirements.",upcoming,https://forms.google.com/,
Risk Management in Volatile Markets,2026-05-20,3:00 PM GMT,"Husain Feroz Ali (CEO & Founder)","Understanding and managing risk in today's uncertain economic environment. Practical tools and frameworks for insurance professionals.",upcoming,https://forms.google.com/,
Power BI for Actuaries,2025-12-15,2:00 PM GMT,"Rahul Kalani (Manager)","Recorded session on building actuarial dashboards with Power BI. Covers data modeling, DAX formulas, and visualization best practices.",recorded,,https://youtube.com/watch?v=example
